{"schemaVersion":"1.0.0","artifactType":"decision-memo","proposalOnly":true,"sourceDigests":["sha256:aaaaaaaaaaaaaaaaaaaaaaaaaaaaaaaaaaaaaaaaaaaaaaaaaaaaaaaaaaaaaaaa"],"upstreamArtifactDigests":["sha256:d632bd8fc1b03d0647381401e52934cb94463ec971a9b5a3e388ea5ec96687f7"],"data":{"options":["Keep the current synthetic process.","Propose a bounded revision."],"tradeoffs":["A revision adds review work."],"dissent":[],"reversibility":"Repository proposal can be reverted before enactment.","status":"proposed"}}
